Title,TagsAndSkills,Company,Currency,Salary,Location,Experience,JdURl,Jobdescription,CreatedAt
IBM Sterling OMS with SAP OTC,"order management,IBM sterling OMS,sap otc,order to cash,XML,Microsoft,Gap,SAP",i2t2 India,INR,Not disclosed,Remote,7-12 Yrs,/job-listings-ibm-sterling-oms-with-sap-otc-i2t2-india-hyderabad-secunderabad-7-to-12-years-110623001487,"1+ years of experience with OMS solutions and / or implementation experience in one of the following: Manhattans Active Omni,IBM Sterling OMS,Blue Yonder OMS,SAP OTC,Fluent Commerce or Salesforce <br><br>Experience using analytics and metrics to assess order processing and customer experience to identify and quantify improved opportunities <br><br>A Bachelors Degree",11/6/2023
Business Development Manager-B2B Saas (US Market),"Business Development,B2B Sales,Development,B2B,Leadership,Generation,SAAS Sales,Zoominfo",Connexions,INR,Not disclosed,"Chennai, Bengaluru",5-8 Yrs,/job-listings-business-development-manager-b2b-saas-us-market-connexions-chennai-bangalore-bengaluru-5-to-8-years-110623901425,Manage a team of hybrid BDRs ( Must Have)<br><br>2+ years of inside sales / lead generation management experience<br><br>2+ years of SAAS sales experience,11/6/2023
Us It Recruiter,"US Staffing,IT recruitment,Linkedin,Recruitment,H1b,Monster,Technical,W2",BIT Soft Services,INR,Not disclosed,Remote,5-10 Yrs,/job-listings-us-it-recruiter-bit-soft-services-mumbai-all-areas-5-to-10-years-110623001152,"Sr. Technical Recruiter / US Staffing (Night Shift) <br><br>Must be willing to put standard US Central time hours (Night Shift in Mumbai Office)<br><br> Education: Graduate in any Computers / Information Technology<br><br>Must have 5+ years of experience in recruitments US based candidates<br><br>Understand requirement specification,find and screen candidates,setup interviews etc",11/6/2023
Functional Consultant,"HR Implementation,customer success,darwinbox implementation,HR consulting,HCM implementation,HCM,Hrsd,HR Transformation",Darwinbox,INR,Not disclosed,"Bengaluru, Hyderabad, Gurgaon",2-7 Yrs,/job-listings-functional-consultant-darwinbox-hyderabad-secunderabad-gurgaon-gurugram-haryana-bangalore-bengaluru-2-to-7-years-110623001095,"Brainchild of alumni from the worlds most distinguished organisations (McKinsey,EY,Google),we are the preferred choice of 700+ global enterprises to manage their 2 million+ employees across 90+ countries.  . Darwinboxs new-age HCM suite competes with local as well as global players in the enterprise technology space (such as SAP,Oracle,and Workday)<br><br> MBA in HR is preferred",11/6/2023
Account Manager - CSM,"HR Operations,Core HR,HRIS,darwinbox,Client Handling,Account management,Client,Hrsd",Darwinbox,INR,Not disclosed,Hyderabad,3-8 Yrs,/job-listings-account-manager-csm-darwinbox-hyderabad-secunderabad-telangana-3-to-8-years-110623001079,"Brainchild of alumni from worlds most distinguished organizations (McKinsey,EY,Google),we are the preferred choice of 700+ global enterprises to manage their 2 Million+ employees across 90+ countries<br><br>Support clients to resolve queries or bugs,as and when required<br><br>Gather feedback on product experience during the entire customer lifecycle via targeted surveys",11/6/2023
Business Sales Executive,"business development,Sales management,Marketing management,New business development,Negotiation,Selling,New business,Marketing",Midasha Consultants Llp,INR,6-10 Lacs PA,"Chennai, Bengaluru",3-8 Yrs,/job-listings-business-sales-executive-midasha-consultants-llp-chennai-bangalore-bengaluru-3-to-8-years-110623000784,"Ability to develop strong relationship networks in premium customers which includes Contractors,Developers / Builders,Architects,Institutions (Schools,Colleges,Universities),Corporates,Sports Academies and government departments. <br><br>o Experience in selling more premium products and not just a focus on price<br><br>Positive and good at getting people to like that person",11/6/2023
Associate Principal Engineer (Salesforce),"Architecture,salesforce lightning,Sales Cloud,Apex,Salesforce,Community Cloud,Service Cloud,Lightning",Nagarro,INR,Not disclosed,Remote,9-13 Yrs,/job-listings-associate-principal-engineer-salesforce-nagarro-india-9-to-13-years-110623000783,"Must have experience in independently communicating with clients and requirement gathering<br><br> Strong experience (Architecture) in defining,designing,delivering,and deploying Salesforce-based technical solutions",11/6/2023
Associate Principal Engineer (Salesforce Marketing Cloud),"Mobile Studio,Automation Studio,Journey Builder,Salesforce Marketing Cloud,marketing cloud,Salesforce,Apex,Visual",Nagarro,INR,Not disclosed,Remote,9-13 Yrs,/job-listings-associate-principal-engineer-salesforce-marketing-cloud-nagarro-india-9-to-13-years-110623000740,"Must have knowledge of HTML,CSS,JavaScript,jQuery,JSON,Apex,Visual Force,and Lightning Web Components<br><br>Must have experience in integrating Marketing cloud with various other clouds and third-party systems like Content Management Systems,Google Analytics,DMP and CDP platforms,CRM,etc<br><br>Must be able to create and designs technical implementation diagrams in the Salesforce ecosystem",11/6/2023
Senior Staff Engineer (Salesforce),"Salesforce Sales Cloud,Service Cloud,Salesforce,apex,Visualforce,Sales,Senior,Cloud Sales",Nagarro,INR,Not disclosed,Remote,7-10 Yrs,/job-listings-senior-staff-engineer-salesforce-nagarro-india-7-to-10-years-110623000727,"Experience in communicating effectively with users,other technical teams,and management to collect requirements,and describe software product features,and technical designs Must have experience in independently communicating with clients and requirement gathering<br><br> Strong experience in defining,designing,delivering,and deploying Salesforce-based technical solutions",11/6/2023
Corporate Relationship Manager,"Client Acquisition,relationship management,Sales,Institutional Business,Accounting,Handling,Corporate banking,Marketing",Prashanthi Centre For Fertility,INR,6-10 Lacs PA,Hyderabad,3-8 Yrs,/job-listings-corporate-relationship-manager-prashanthi-centre-for-fertility-hyderabad-secunderabad-telangana-3-to-8-years-110623000707,"<p><strong>Roles and Responsibilities</strong><br /> </p><p>We are looking for an ambitious and energetic Business Development Manager to help us expand our clientele. You will be the front of the company and will have the dedication to create and apply an effective sales strategy.</p><p>The goal is to drive sustainable financial growth through boosting sales and forging strong relationships with clients.</p><p>Developing a business development strategy focused on financial gain</p><p>Arranging business development meetings with prospective clients</p><p>Promote the company's products/services addressing or predicting clients objectives</p><p>Keep records of sales, revenue, invoices etc.</p><ul><li>Proven working experience as a business development manager, sales executive or a relevant role</li><li>Proven sales track record</li><li>Experience in customer support is a plus</li><li>Proficiency in MS Office and      CRM software (e.g. Salesforce)</li><li>Proficiency in English</li><li>Market knowledge</li><li>Communication and negotiation skills</li><li>Ability to build rapport</li><li>Time management and planning skills</li></ul><br /><br /><p>As the Corporate Relations Manager, you will be responsible for initiating and developing relationships with companies with thriving practices in analytics and associated areas.<br /></p><p> Develops and executes marketing strategies, translating customer needs from varied industries and markets into clear value propositions and actionable marketing programs. </p><p>Communicates the corporate marketing message, manages the corporate marketing budget for allocation to marketing activities, and follows through the complete marketing life cycle to measure results. <br /></p><p>Serving as the point of contact and strategic consultant for community engagement within assigned portfolio of accounts and relationships.<br /></p><p>Initiating conversations with HR / recruitment departments of major IT companies, niche analytics firms and varied technology start-ups.<br /> </p><ul><li>Maintain the highest ethical and professional standards within this diverse global organization and recognize employee excellence.</li><li>Responsible for India procurement succession planning and employee development.</li></ul><br /><p><strong>Desired Candidate Profile</strong><br /> </p><ul><li>Minimum of a Bachelor's degree in Marketing or a related field</li><li>Proven experience as a corporate marketing manager or similar role</li><li>Strong understanding of marketing principles and practices</li><li>Proficiency in MS Office and marketing software</li><li>Excellent Prolific writing, research, and analysis skills with an interest in healthcare industry, corporate campaign building</li><li>Good communication and interpersonal skills</li><li>Ability to work independently with minimum supervision</li><li>Comfortable working in a fast-paced environment and have agility in adapting to the situation</li></ul><br /><br />",11/6/2023
Urgent Job Opening For Sr. Salesforce Developer,"Lwc,Aura,Salesforce Lightning,Salesforce,Development,SR,Lightning,Sales force development",360 Degree Cloud Technologies,INR,16-31 Lacs PA,"Delhi NCR, Delhi, Bengaluru, Mumbai (All Areas)",5-7 Yrs,/job-listings-urgent-opening-for-sr-salesforce-developer-360-degree-cloud-technologies-new-delhi-delhi-bangalore-bengaluru-karnataka-delhi-ncr-mumbai-all-areas-5-to-7-years-110623000105,"LWC is highly preferred<br><br>Good Hands-on with lightning,apex,visual force,and Apex Triggers<br><br>Experience application development using Apex classes,Visual Force pages,triggers,S-Objects,creating report types,reports,and dashboards Strong experience in Development and Customization in Salesforce.com",11/6/2023
Senior Salesforce Developer,"salesforce,Senior,Integration,Development,System architecture,Design,Sales force development,System design",Stamens Software,INR,Not disclosed,Remote,6-11 Yrs,/job-listings-senior-salesforce-developer-stamens-software-pvt-ltd-noida-uttar-pradesh-6-to-11-years-110623000063,"Service Cloud Certification is required<br><br>years of experience functioning as Salesforce.com administrator for Enterprise edition or higher Solid understanding of system architecture and system design (SFDC /CRM and Force.com) is required<br><br>Salesforce.com Communities,Partner / Customer Portal implementation,Knowledge Base Experience with Salesforce.com security model and sharing rules",11/6/2023
Campaign Management Associate-Campaign Management,"Reporting Analysis,Campaign Management,Analysis,Direct,Marketing,Operations,Email marketing,Excel",Accenture,INR,Not disclosed,Hyderabad,1-3 Yrs,/job-listings-campaign-management-associate-campaign-management-accenture-solutions-pvt-ltd-hyderabad-secunderabad-1-to-3-years-110623900044,"Please note that this role may require you to work in rotational shifts<br><br>Qualifications: Any Graduation. Years of Experience: 1 to 3 years<br><br>Skill required: Campaign Management - Reporting Analytics. <br><br>In this role you are required to solve routine problems,largely through precedent and referral to general guidelines",11/6/2023
Campaign Management Analyst-Digital Marketing,"Digital Marketing,Campaign Management,Direct,Marketing,Operations,Display advertising,Email marketing,Direct marketing",Accenture,INR,Not disclosed,Bengaluru,3-5 Yrs,/job-listings-campaign-management-analyst-digital-marketing-accenture-solutions-pvt-ltd-bangalore-bengaluru-3-to-5-years-110623900043,Please note that this role may require you to work in rotational shifts<br><br>Qualifications: Any Graduation. Years of Experience: 3 to 5 years<br><br>Skill required: Digital Marketing - Campaign Management. <br><br>In this role you are required to do analysis and solving of increasingly complex problems <br><br>Adobe Launch - Good to Have <br><br>Adobe Analytics - Good to Have,11/6/2023
HR Ventures & Acquisition Assoc Manager - DE Capability,"HR Operations,Talent Management,Architecture,Due diligence,Human resource management,Operations,Diligence,Compliance",Accenture,INR,Not disclosed,Bengaluru,10-14 Yrs,/job-listings-hr-ventures-acquisition-assoc-manager-de-capability-accenture-solutions-pvt-ltd-bangalore-bengaluru-10-to-14-years-110623900041,"Qualifications: Any Graduation. Years of Experience: 10 to 14 years<br><br>Skill required: HR Operations - Talent Management. <br><br>You will be aligned to our HR Ventures & Acquisitions vertical and will help us in the function that deals with people and people experience related areas for an acquisition such as communications,change management,onboarding and culture",11/6/2023
Salesforce Conga CPQ Application Developer,"Salesforce,Application,Development,Business applications,Cpq,Conga,Salesforce Cpq,Sales force development",Accenture,INR,Not disclosed,Bengaluru,4-6 Yrs,/job-listings-salesforce-conga-cpq-application-developer-accenture-solutions-pvt-ltd-bangalore-bengaluru-4-to-6-years-100623906135,"Educational Qualification : Regular 15-year full time education <br><br>Technical Experience : 1 Experience in Salesforce 2 Experience with Steelbrick / Salesforce CPQ,Apttus,or BigMachines is strongly preferred with Apttus the preference <br><br>Professional Attributes : a Must have Good Communication skill b Capable of Client facing rolec Good to have Handled Team of 3-5 junior Developers",10/6/2023
Campaign Management New Associate-Campaign Management,"Reporting Analytics,Campaign Management,Reporting,Reporting And Analytics,Email,Direct,Marketing,Operations",Accenture,INR,Not disclosed,Hyderabad,0-1 Yrs,/job-listings-campaign-management-new-associate-campaign-management-accenture-solutions-pvt-ltd-hyderabad-secunderabad-0-to-1-years-100623906125,"Please note that this role may require you to work in rotational shifts<br><br>Qualifications: Any Graduation. Years of Experience: 0 to 1 years<br><br>Skill required: Campaign Management - Reporting Analytics. <br><br>In this role you are required to solve routine problems,largely through precedent and referral to general guidelines",10/6/2023
Salesforce Development Application Developer,"Salesforce Development,Salesforce,Cloud,Unit testing,JIRA,SFDC,Jenkins,Software testing",Accenture,INR,Not disclosed,Hyderabad,4-6 Yrs,/job-listings-salesforce-development-application-developer-accenture-solutions-pvt-ltd-hyderabad-secunderabad-4-to-6-years-100623906122,"Work Experience :4-6 years <br><br>Technical Experience : 1 Experience in Service cloud features like Case Management,Omni-channel Live agent etc 2 Experience in Salesforce administration such as Profiles,Permission sets etc 3 Experience with development tools such as ANT,Forcecom,Git,Jenkins,Jira Visual Code <br><br>Professional Attributes : Good Communication Skill",10/6/2023
Assistant Manager - Sales (Banquets & Catering),"Communication Skills,Catering Sales,MS Office Tools,Banquet Sales,Interpersonal Skills,Sales,Microsoft,Interpersonal",Catering Collective (Kapco Banquets and Catering Pvt. Ltd.),INR,5.5-8 Lacs PA,Delhi(Ghitorni),4-7 Yrs,/job-listings-assistant-manager-sales-banquets-catering-catering-collective-kapco-banquets-and-catering-pvt-ltd-new-delhi-delhi-4-to-7-years-100623006037,"Assist in the preparation and monitoring of sales,department and budgetary reports as and when required<br><br>Minimum 4 years experience in Sales with a 5 / 4 Star Hotel or Luxury/ Premium Banquet or Catering company<br><br>Proficient in MS Office Suite,and CRM tools like Salesforce or similar <br><br>Commitment to delivering an elevated level of customer experience",10/6/2023
Business Development Executive (BDE)- Male/Female-Porur (0-2 Yrs),"Business Development,Cold,Sales,Development,Client acquisition,Client management,IT sales,Acquisition",Soft Suave,INR,2-4 Lacs PA,Chennai(Porur),0-2 Yrs,/job-listings-business-development-executive-bde-male-female-porur-0-2-yrs-soft-suave-chennai-tamil-nadu-0-to-2-years-100623005750,Join the smart technology team and experience the growth . <br><br> Must possess strong customer service skills<br><br>Must be able to create Presentations & to present in client meetings<br><br>Good understanding of business needs and customer focus,10/6/2023
CN - CS&S - C&S - Intelligent Functions - 06,"Team Management,Presales,sales strategy,Customer engagement,Sales,Cs,Cpq,S",Accenture,INR,Not disclosed,"Chennai, Pune, Mumbai, Bengaluru, Gurgaon, Jaipur, Kolkata",12-16 Yrs,/job-listings-cn-cs-s-c-s-intelligent-functions-06-accenture-solutions-pvt-ltd-kolkata-mumbai-pune-chennai-gurgaon-gurugram-jaipur-bangalore-bengaluru-12-to-16-years-100623905174,"Lead vision for clients through roadmaps,capability maps,reference architectures,and other enterprise architecture assets to communicate the best-fit solution considering technology,industry trends,platform experience and other relevant factors<br><br>Good to have Certifications: Certifications/ core experience in Salesforce CRM is required with hands on expertise in following areas",10/6/2023
Business Analyst,"CRM Management,Zoho Crm,Salesforce CRM,Business Analysis,Salesforce,Analysis,Management,Zoho",Eppeok Solutions,INR,6-8 Lacs PA,Mohali,5-10 Yrs,/job-listings-business-analyst-eppeok-solutions-mohali-5-to-10-years-120523006857,"Proven Zoho administrative skills
Familiarity with Zoho Integration components for ZOHO
Proficient with technology, including office applications, sales force automation, database systems",10/6/2023
Business Development Manager - PAN India,"Business Development Manager,Direct selling,Salesforce,Marketing,Servicing,Generation,Furniture Sales,Management",Alankaram,INR,5.5-10 Lacs PA,"Bhubaneshwar, Delhi NCR, Ranchi, Lucknow, Ahmedabad, Kochi, Patna, Hyderabad, Kolkata",4-8 Yrs,/job-listings-business-development-manager-pan-india-alankaram-kochi-cochin-kerala-bhubaneswar-odisha-kolkata-patna-bihar-hyderabad-secunderabad-lucknow-uttar-pradesh-ranchi-jharkhand-ahmedabad-delhi-ncr-4-to-8-years-160222010481, . Bachelors degree or equivalent experience <br><br>Proficiency in MS Office and CRM software (e.g<br><br>They should be able to think critically when making plans and have a demonstrated ability to execute a particular strategy.  . <br><br>Experience / background in interior designing or architecture is a plus,10/6/2023
Customer Success Manager  - SAAS Based IT Setup,"Customer Success,Technical,Customer experience,Account management,Accounting,Management,Product management,SQL",Antrors HR Solutions,INR,Not disclosed,Mumbai,7-8 Yrs,/job-listings-customer-success-manager-saas-based-it-setup-antrors-hr-solutions-mumbai-7-to-8-years-100623904873,"A Customer Success Manager is responsible for developing customer relationships that promote retention and loyalty. Their job is to work closely with customers to ensure they are satisfied with the services they receive and to improve upon areas of dissatisfaction.<br /><br />Responsibilities:<br />1. Understand the client's needs and pain points to help to configure the software for the client.<br />2.Onboarding and execution of Client: Responsible for the fast and quality execution of the client on Organisations platform. The Customer Success Manager must establish policies the entire staff can adhere to so all customers receive the same quality of execution.<br />3. Establish Customer Success Practices: Responsible for creating policies and procedures that optimize the customer experience. CSM's may gather feedback from their customers, study other customer success programs, and analyze customer data to identify the best practices. You must establish policies the entire staff can adhere to so all customers receive the same quality of service.<br />4. Upselling: Ability to upsell the new features and also to scale up the business from the existing client.<br />5. Assisting in Technical and Product Management: You must know the company’s products inside and out. They are capable enough to rather on educate the customers on the flexibility and capabilities of their software so customers are encouraged to continue using their services.<br />6. Provide on-the-job training or mentoring to new employees/client Project stakeholders.Additionally, take initiatives for improvising processes, new implementations, new practicesboth technically and culturally.<br />8. Ability to handle multiple clients at a time. He should have multitasking skills and should be able to deal with bottom to top hierarchy of Client.<br /><br />Educational Qualification / Work Experience / Skills :<br />1. PG / MBA / B.Tech with min 6+yrs experience and at least 2+ years relevant work experience in a customer-facing role (customer success or account management).<br />2. Previous experience collaborating with different internal functions within a fast-growing SaaS company; operating at the intersection of product, sales, and delivery<br />3. Experience in CRM/ERP (e.g. Salesforce, Pipedrive) or B2B Enterprise level software<br />4. Familiarity with Supply Chain data and workflow experience preferred<br />5. Basic Knowledge of web technologies like HTML, SQL, API, Json, iOS and Android platforms<br />6. Proficient in Microsoft Office Suite specifically Excel and PowerPoint<br />7. Should possess fantastic interpersonal skills<br />8. Proactive and willing to improve on processes<br />9. Technical aptitude and ability to learn software programs.<br />",10/6/2023
Campaign Management Specialist-Digital Marketing,"Direct marketing,Campaign management,Email marketing,Marketing operations,Digital marketing,Digital,Display Video,Atlassian",Accenture,INR,Not disclosed,Bengaluru,7-11 Yrs,/job-listings-campaign-management-specialist-digital-marketing-accenture-solutions-pvt-ltd-bangalore-bengaluru-7-to-11-years-100623904528,Please note that this role may require you to work in rotational shifts<br><br>Qualifications: Any Graduation. Years of Experience: 7 to 11 years<br><br>Skill required: Digital Marketing - Campaign Management. <br><br>In this role you are required to do analysis and solving of increasingly complex problems <br><br>Adobe Launch - Good to Have <br><br>Adobe Analytics - Good to Have,10/6/2023
Assistant Marketing Manager,"Marketing Campaigns,Marketing Communication,CRM Management,Growth Marketing,Performance Marketing,Design Conceptualization,MS Office,Content",Catering Collective (Kapco Banquets and Catering Pvt. Ltd.),INR,7-9 Lacs PA,Mumbai(Worli +1),4-7 Yrs,/job-listings-assistant-marketing-manager-catering-collective-kapco-banquets-and-catering-pvt-ltd-mumbai-maharashtra-4-to-7-years-100623004426,"Minimum 4 years experience in a brand marketing role having managed multiple marketing vendors,agencies,and team members<br><br>Proficient in MS Office,and CRM tools like Zoho/ Salesforce/ or similar <br><br>Customer Experience Custodian of brand identity to maintain consistency and excellence of customer experience across every touchpoint of the brand (in-store,offline,online)",10/6/2023
SAP IRPA Consultant/intelligent Robotic Process Automation,"intelligent Robotic Process Automation,SAP IRPA Consultant,Robotic Process,Consulting,Process automation,Automation,Intelligent,Robotic Process Automation",Infosight Consulting Services,INR,Not disclosed,Remote,2-7 Yrs,/job-listings-sap-irpa-consultant-intelligent-robotic-process-automation-infosight-consulting-services-bangalore-bengaluru-2-to-7-years-100623004378,"Prefered At least 2-3 years of experience In a shared service organization as a developer of IRPA
Experience in automating ERP systems like SAP, JDE, Salesforce, and other non-ERP systems
Experience in Programming with Javascript, VB Script, Python",10/6/2023
Client Relationship Marketing Professional,"marketing,Campaign management,Social media,CRM,Client Relation,Relationship marketing,Project,Campaigns",Accenture,INR,Not disclosed,"Hoshiarpur, Bengaluru",0-3 Yrs,/job-listings-client-relationship-marketing-professional-accenture-solutions-pvt-ltd-hoshiarpur-bangalore-bengaluru-0-to-3-years-100623904318,"pursuit / deal-based marketing experience highly desirable<br><br>Experience with Salesforce or similar CRM desirable,e.g<br><br>Hands-on marketing experience,ideally in professional services or other B2B organisation<br><br>Demonstrable experience in using different channels,including social media,email and direct mail<br><br>Experience using Eloqua (or similar email platform) desirable",10/6/2023
Salesforce Field Service Lightning,"Validation,Implementation,Salesforce Field Services Lightning,Field,Configuration,Salesforce,Field Job,Technical",Cosmicit Informatics India,INR,Not disclosed,"Pune, Ahmedabad, Bengaluru",5-10 Yrs,/job-listings-salesforce-field-service-lightning-cosmicit-informatics-india-pune-maharashtra-ahmedabad-bangalore-bengaluru-5-to-10-years-100623004229,"Perform Code Review and Code Optimization on Lighting component, Implement Salesforce Lightning Industry best practices, Create technical design from Functional design, Able troubleshoot with debugging skill, Perform configuration and customization",10/6/2023
