Title,TagsAndSkills,Company,Currency,Salary,Location,Experience,JdURl,Jobdescription,CreatedAt
Technical Support Specialist,"Software Customer Support,System,MS Products,Salesforce,Ticketing,Ticketing Tools,Technical,Customer support",Ametek Instruments India,INR,Not disclosed,Bengaluru,3-5 Yrs,/job-listings-technical-support-specialist-ametek-instruments-india-bangalore-bengaluru-karnataka-3-to-5-years-090623908356,"<p>The Technical Support Specialist is responsible for providing application and hardware support for the SkyBitz customer base via the phone an email. The Technical Support Specialist will be responsible for answering basic application and hardware questions related to GPS functionality, software navigation, configuration and reporting. They will provide tier-level triage of reported issues and identifying solutions to work. </p><p>Tier 1 staff members are responsible for receiving initial contact from customer, providing acknowledgement of receipt, and performing analysis toward resolution. Analysis will be limited to recreating the issue, reviewing current configurations and evaluating hardware issues. If resolution cannot be achieved through workarounds, data/product manipulation, and/or configuration changes, Tier 1 will escalate to Tier 2 for further technical review. At this time Tier 1 relinquishes responsibility and accountability for customer to Tier 2.</p><p>If it is determined that the resolution to the issue involved a base code/firmware bug fix, the Tier I Technical Support Specialist may work with engineering directly to resolve. In this case, the responsibility of the Support ticket will remain with the Tier I, who will monitor the issue with engineering for updates and resolution.</p><br /><p><strong>Duties and Responsibilities</strong></p><ul><li> Process in-bound calls, research support tickets placed through email and phone and manage resolution of technical issues. </li><li> Understand and educate customer callers on various system functions</li><li> Troubleshoot specific system operational problems encountered by customers and attempt to provide immediate solutions</li><li> Provide resolutions and/or workarounds to customer</li><li> Document all activity in the associated case</li><li> Inform appropriate departments of certain requests that are initiated by customer, but cannot be performed by customer care</li><li> Work with other departments (Engineering, Customer Experience) to resolve customer issues. </li><li> Provide excellent client management, responsive follow through, and communication of client issues within the impacted internal teams </li><li> Manage queue on a daily basis by prioritizing tickets, updating status, and documenting all action taken.</li><li> Prioritizing numerous issues of varying severity, and effectively manages the resolution of all issues within accepted agreements. </li><li> Seek escalation at appropriately defined times</li><li> Ownership of the data entered into the Sales Force ticketing system and appropriately updating both client and SkyBitz teams of status of all issues on a timely basis</li><li> Collaborate extensively with peers, and developers to resolve client issues while improving the effectiveness of the team and the information available to our clients</li><li> Follow-up with customer to ensure resolution meets customer requirements and expectations</li><li> Ability to interact with customers and team members with professionalism and maturity</li><li> Perform special projects and other duties as assigned</li><li> Provide updates to resolution status based on defined process and SLAs while the ticket is owned by Tier 1</li><li> Ensure that customers are getting value from Customer Support by having a professional attitude, regular follow-up, and proactive communication of issues to management</li><li> Become knowledgeable on all application and hardware functionalities by working with local product experts on targeted areas</li></ul><br /><p><strong>Qualifications</strong></p><ul><li> 3  5 years Software Customer Support experience</li><li> Experience in a self-directed work environment</li><li> Demonstrated ability to research and resolve problems using a variety of resources and tools</li><li> Strong verbal and written communication skills</li><li> Ability to clearly and effectively present information and respond to questions from groups within and outside the company, especially through telephone conversation.</li><li> Ability to solve practical problems and deal with a variety of concrete variables in situations where only limited standardization exists</li><li> M2M industry knowledge</li><li> Working knowledge of SQL preferred</li><li> Good organization skills, with ability to properly document and track information</li><li> Fast learner with intellectual curiosity to understand complex applications</li><li> Ability to work with others to resolve problems </li><li> Ability to communicate information well to customers, management, and co-workers verbally and in writing.</li><li> Ability to make satisfied customers a priority; polite and courteous to all and able to handle difficult customers with respect.</li><li> Problem solving skills with ability to research problems and search for solutions. </li><li> Must be dependable with good attendance record and work habits to provide coverage to a 24x7 production system</li></ul><br /><p><strong>Notes:</strong></p><p>Good communication skills</p><p>Customer interaction skills</p><p>Supported similar type of technology products, h/w or s/w. Trouble shooting experience </p><p>Basic MS product skills.</p><p>Sales force experience </p><p>Tracking device, supported by GPS </p><p>Transportation industry (truck industry)</p><p>Eastern time (8 am to 7 pm)  night shift in India</p><p>Basava mentioned 8 to 10L would be the cost. Need to re-confirm this after checking internally</p>",9/6/2023
"Business Development Executive- Fresher || Novigo Solutions, Mangalore","mail campaign,Lead Generation,It Services Sales,Cold Calling,Market Research,Calling,B2B Sales,Email Campaign",Novigo Solutions,INR,Not disclosed,Mangalore,0-1 Yrs,/job-listings-business-development-executive-fresher-novigo-solutions-mangalore-novigo-solutions-mangaluru-mangalore-karnataka-0-to-1-years-090623008272,Location - Mangalore (Work from Office) . Notice Period : Preferred immediate joiner. : . Familiarizing yourself with all products and services offered by our company<br><br>Experience : 0 to 1 Year.,9/6/2023
Chief Manager Business Development API Generics,"Business Development,api,Business development management,Generic,Management,Client relationship,Generics,Client Relation",Piramal Healthcare,INR,Not disclosed,Mumbai (All Areas),10-20 Yrs,/job-listings-chief-manager-business-development-api-generics-piramal-healthcare-mumbai-all-areas-10-to-20-years-090623008048,"<p> </p><p><strong>JOB</strong> <strong>OVERVIEW:</strong></p><p>The individual will be responsible for supporting existing customers, proactively identifying and building new customer relationships for Piramal Pharma Solutions, API G business in the Western EU and MENA markets to deliver year on year revenue and pipeline opportunity growth targets. </p><br /><p><strong>KEY STAKEHOLDERS:</strong> <strong>INTERNAL</strong> </p><p>Business Development Team, Site Heads and Site Leadership Teams, Program Management Heads, R&D, Regulatory Affairs, Strategic Marketing, Finance</p><br /><p><strong>KEY STAKEHOLDERS:</strong> <strong>EXTERNAL</strong></p><p>Customers</p><br /><p><strong>REPORTING STRUCTURE: </strong></p><p>Reports to Global Head Business Development  API Generics</p><br /><p><strong>ESSENTIAL QUALIFICATION: </strong></p><p>Bachelors degree in a scientific subject or equivalent experience in a relevant environment. (chemistry, biology etc. would be preferred)</p><br /><p><strong>RELEVANT EXPERIENCE: </strong></p><p>Preferred experience of 13  15 years in a business development role with significant commercial experience in the Pharma, Biotech or CDMO space. </p><p>Previous experience in handling EU and MENA would be preferred</p><p>Previous experience in Peptide APIs would be preferred</p><p>Proven track record in delivering year on year business targets for complex high value deals</p><br /><p>  </p><p><strong>KEY</strong> <strong>COMPETENCIES:</strong> </p><p>•Strong understanding of the API Generics market especially Peptides •Demonstrated track record to secure new customers, exhibiting a strong close rate </p><p>•Effective at working with scientists and other customer stakeholders, up to and including C- Suite leaders, to discuss the value proposition of Piramal`s offerings </p><p>•Understanding of SalesForce.com customer contact management system </p><p>•Adept at building strong internal network and navigating the organization to optimize influence for ensuring appropriate support levels for territory opportunities </p><p>•Strong interpersonal and leadership skills •Customer Centric with the ability to build relationships based on trust and long term commitment.   </p><p>•Experience of working in and driving teams to a specific customer based result.   </p><br /><p><strong>KEY</strong> <strong>ROLES/RESPONSIBILITIES:</strong> </p><p>The individual will working closely with representatives from all departments to lead the implementation and delivery of the sales plan in the assigned geography to support short-term and long-term growth strategy of the API Generics business.</p><ul><li>Responsible for generating new business from new customers and existing accounts through a high level of customer contact including frequent direct customer visits, virtual meetings and extensive networking activities </li><li>Demonstrate strategic business awareness of the market and customers in order to differentiate our business from the competition </li><li>Effectively promote current technical capabilities and emerging / new technologies as they become available to facilitate generation and closing of new business opportunities </li><li>Identify sales opportunities and establish relationships with existing customers to generate future sales, avenues for cross selling and repeat business. Develop and implement strategic plans for key accounts in assigned territory </li><li>Contact new accounts and leverage network to map opportunities </li><li>Prepare and deliver client proposals in collaboration with Program Managers. Negotiate agreements of sale to close accounts and secure long-term agreements </li><li>Interface with supply planning/production functions and export logistics/shipping team to ensure dispatch as per customer time-lines and liaise with regulatory team to meet statutory requirements </li><li>Participate in strategy and annual planning meetings. Report out on sales performance and funnel. Develop forecast, budget and track performance </li><li>Retain, expand and strengthen client relationships by ensuring high-quality customer service and issue resolution </li><li>Manage sales activities on the SalesForce.com platform</li></ul>",9/6/2023
Salesforce Service Cloud Application Developer,"Cloud computing,Salesforce Service Cloud,Business analysis,Agile,User acceptance testing,Salesforce,Development,Software development",Accenture,INR,Not disclosed,Hyderabad,4-6 Yrs,/job-listings-salesforce-service-cloud-application-developer-accenture-solutions-pvt-ltd-hyderabad-secunderabad-4-to-6-years-090623907964,Professional Attributes : A: Proficient communications skillsB: Should be good in confidenceC: Good learning skills <br><br>Work Experience :4-6 years,9/6/2023
Business Analyst || Functional Oracle Fusion Consultant,"Requirement Gathering,Documentation,UAT,Solution Design,oracle fusion,Cloud,Consulting,Mapping",Innova Solutions,INR,10-20 Lacs PA,"Chennai, Pune, Vadodara, Delhi NCR, Kanpur, Bengaluru, Hyderabad, Noida",5-10 Yrs,/job-listings-business-analyst-functional-oracle-fusion-consultant-innova-solutions-noida-uttar-pradesh-hyderabad-secunderabad-telangana-kanpur-uttar-pradesh-pune-maharashtra-chennai-tamil-nadu-bangalore-bengaluru-karnataka-5-to-10-years-090623007897," . Strong experience as a Functional BA (Oracle Fusion Fuctional Consultant),eliciting requirements from Business/ Operations teams and effectively working with technology teams for delivering the digital transformation initiatives. <br><br>Process Mapping and Designing experience preferred.  . <br><br>Experience of working with Oracle Fusion across multiple projects.  . .",9/6/2023
Urgently Hiring Sr. SAP ABAP Developers- Mumbai Location,"SAP,ECC,Abap,Hiring,Development,SAP ABAP,SAP ABAP Development,SR",HR Central,INR,Not disclosed,"Navi Mumbai, Mumbai (All Areas)",5-10 Yrs,/job-listings-urgently-hiring-sr-sap-abap-developers-mumbai-location-hr-central-navi-mumbai-maharashtra-mumbai-all-areas-5-to-10-years-220523006222,"Shift Timing - Afternoon shift starts at 1:30 PM. Bachelors degree in Computer Science,Information Systems,or a related field.  <br><br>Experience with agile development methodologies,such as Scrum,is a plus.  . SAP certification in ABAP or related modules is a plus.  . SAP FIORI experience is a plus.  . SAP Salesforce Integration is a plus. <br><br>Web Service & REST Service experience.",9/6/2023
SAP ABAP Consultant_Mumbai,"SAP ECC,Sap S4Hana,SAP ABAP,SAP BW,Abap,Web services,Saps,BW",HR Central,INR,Not disclosed,"Navi Mumbai, Mumbai",5-10 Yrs,/job-listings-sap-abap-consultant-mumbai-hr-central-mumbai-navi-mumbai-5-to-10-years-160523010598,"<p> </p><p>Dear Candidate, </p><br /><p>Greetings from HR Central!</p><br /><p>A global leader in innovative and sustainable building solutions is looking for you.</p><br /><p>So, we are excited to share a job opening for <strong>SAP ABAP</strong> with you for our client.</p><br /><p>Please find mentioned below the job description:</p><br /><p><strong>Experience</strong>:<strong> Minimum 5 Years</strong></p><br /><p><strong>Job Location:</strong> Airoli, Navi Mumbai</p><p> </p><p><strong>Shift timing:</strong> Afternoon shift (Starts at 1:30pm)</p><br /><p><strong>Role: SAP ABAP</strong></p><br /><p><strong>Job Description as follows:</strong></p><br /><p><strong>Roles and Responsibilities</strong></p><br /><ul><li>Bachelor's degree in Computer Science, Information Systems, or a related field.</li><li>Minimum of 5 years of experience in ABAP programming, including experience with SAP ECC and S/4HANA.</li><li>Strong knowledge of various SAP modules, such as MM, SD, FI, CO, PP, and HR.</li><li>Excellent English communication skills, both written and verbal.</li><li>Strong problem-solving and analytical skills.</li><li>Ability to work independently and as part of a team.</li><li>Web Service & REST Service experience</li><li>Knowledge of SAP integration technologies, such as IDocs, ALE, and RFC-.</li><li>Knowledge of SAP BW and experience in connecting ECC with BW systems.</li><li>Experience with agile development methodologies, such as Scrum, is a plus.</li><li>SAP certification in ABAP or related modules is a plus.</li><li>SAP FIORI experience is a plus.</li><li>SAP  Salesforce Integration is a plus</li></ul><br /><p>In case you wish to apply, please share your updated CV at tina.sapra@hr-central.in along with the following details:</p><br /><p>1. Current CTC</p><p>2. Expected CTC</p><p>3. Negotiable Notice Period</p><p>4. Years of experience in SAP ABAP Programming</p><p>5. Experience with SAP ECC and S/4HANA: Yes/No</p><p>6. How many implementations in ABAP</p><p>7. Web Service & REST Service experience: Yes/No</p><p>8. Knowledge of SAP BW and experience in connecting ECC with BW systems: Yes/No</p><p>9. Knowledge of SAP integration technologies, such as IDocs, ALE, and RFC: Yes/No</p><br /><p>Thanks and Regards,</p><p>Tina Sapra</p><p>tina.sapra@hr-central.in</p>",9/6/2023
"Urgent Hiring - Sales Operations Leader - Mumbai, Thane","salesforce,sales operations,sfdc,Hiring,Leadership,Operations,Analytics,Resolution",HR Central,INR,Not disclosed,Mumbai (All Areas),5-9 Yrs,/job-listings-urgent-hiring-sales-operations-leader-mumbai-thane-hr-central-mumbai-all-areas-5-to-9-years-040523009314,"Good commercial acumen and understanding to confidently drive and monitor business nos <br><br> Good leadership & communication skills to drive,review & own business outlook reviews on a weekly,daily basis<br><br> Good Analytic skills and highly efficient on complex excel,ppt,power BI",9/6/2023
Project Manager - Salesforce,"Lightning,HTML,Salesforce,Framework,MVC framework,Loader,Javascript,MVC",Mindzvue Technologies,INR,Not disclosed,Remote,4-5 Yrs,/job-listings-project-manager-salesforce-mindzvue-technologies-nagpur-4-to-5-years-090623007670,"<p><em>Be a trailblazer, an innovator, a lifelong learner, and get an opportunity to be the master of your destiny. A career at mindZvue gives you more than you can imagine, more than you can expect from a 9 to 6 job!</em></p><br /><p><strong>Job Title - Project Manager (Salesforce) </strong></p><ul><li> Location - Nagpur, Bengaluru, or Remote (Anywhere in India)</li><li> Position - Full Time</li><li> Hiring Company - mindZvue Technologies (A mindZcloud Enterprise)</li><li> Internal Title - Cloud Apps Project Manager</li><li> Department - Cloud Apps Consulting </li></ul><br /><p><strong>Responsibilities</strong></p><ul><li> Assists clients in the design, business architect, process development, functional implementation, and support of Salesforce CRM Applications.</li><li> Experience and demonstrate an understanding of overall SFDC architecture and platform.</li><li> Effectively run business user design and user experience sessions.</li><li> Provide experience in designing workflow rules to enforce business processes.</li><li> Uses consulting skills, business knowledge, and SFDC CRM experience to lead business / functional discussions with the client and internal teams (design, build, test teams).</li><li> Demonstrate experience in Agile, Scrum, and Waterfall methods for Software Development Life Cycle (SDLC).</li><li> Understand the clients business pain points and offer a solution to address leveraging the Salesforce.com platform/ offerings.</li><li> Provide experience in designing workflow rules to enforce business processes.</li><li> Familiar with executing system and user acceptance testing, user adoption, change management, adoption, and training methods.</li><li> Communicate issues, risks, and concerns proactively to management.</li><li> Provide technical guidance leadership to small teams of programmers.</li><li> Track and review the progress of project modules.</li><li> Share Monthly/quarterly presentations to all stakeholders.</li><li> Escalates blocking issues to appropriate teams.</li><li> Monitors and manages project financials, scope, and schedule to ensure the project stays on track for assigned client projects. </li><li> Drives implementations of high-quality cloud solutions<em>.</em></li></ul><br /><p><strong>Experience</strong></p><ul><li> 4+ years experience as a project manager.</li><li> Demonstrated project leadership skills, with direct responsibility for managing project teams, budget, and schedule.</li><li> Outstanding and effective interpersonal skills; along with strong communication skills both verbal and written.</li><li> Experience implementing Small, Medium, and Enterprise-scale Salesforce solutions.</li><li> Hands-on ability in the configuration.</li><li> Create and manage project plans; monitor and review project progress and timelines; adjust schedules and plans as needed, and identify and resolve issues to ensure project success.</li><li> Manage day-to-day execution of project implementations. Assist with the planning, tracking, documentation, and status updates for the project.</li><li> Exercise solid project leadership skills combined with solid business acumen and in-depth analytic skills.</li></ul><br /><p><strong>Our Ideal Candidate</strong></p><ul><li> Experience implementing Small, Medium, and Enterprise-scale Salesforce solutions.</li><li> Extensive external consulting experience, including CRM consulting and hands-on experience with Salesforce.</li><li> Effective decision-making and critical thinking skills for problem identification and solution recommendations.</li></ul><br /><p><strong>About mindZvue Technologies</strong></p><p>We are a Certified Salesforce Implementation Partner that believes in the power of collaborations. There are no customers in a future business landscape; everyone is a partner. With the customer on our side, our mantra #DeliverMoreTogether stands tall as we help their business reach its pinnacle by implementing the foremost Salesforce Solution from the Salesforce ecosystem. Starting from Financial Service Cloud experts, Hi-Tech cloud implementation, and Facility Management Service Providers, we cater to partners across domains. </p><p>To achieve what we want to deliver, we are constantly on the hunt for innovators and job-seekers obsessed with the Salesforce Platform and other cloud-based technologies so that together we can drive excellence and perfection while creating a global impact.</p><br /><p><strong>Know the Benefits Crafted for You:</strong></p><ul><li> Work from Anywhere </li><li> Loyalty Card - Free Meal Card of Rs. 2200 every month</li><li> Corporate Health Insurance </li><li> Smartphone/Internet reimbursement</li><li> Health/wellness program reimbursement</li><li> Smart Watch (Apple/Android) for the new joiners</li><li> Paid Vacation for Family of up to Rs. 30,000/- </li><li> Parents Master Checkup</li></ul><br /><p><strong>Join Our Bandwagon!</strong></p><p>Explore our website and social media channels to get familiar with our company and the work culture we follow. Dive into our virtual world @mindZcloud (Our Parent organization) & @mindZvue (Our Salesforce Implementation focused organization)</p><br /><p><strong>Follow mindZcloud Technologies</strong></p><ul><li> Facebook - https://www.facebook.com/mindzcloud</li><li> Linkedin - https://www.linkedin.com/company/mindzcloud-technologies/</li><li> Twitter - https://twitter.com/mindZcloud</li><li> Instagram - https://www.instagram.com/mindzcloud</li></ul><br /><p><strong>Follow mindZvue Technologies</strong></p><ul><li> Facebook - https://www.facebook.com/mindZvue</li><li> Linkedin - https://www.linkedin.com/company/mindZvue</li><li> Twitter - https://www.twitter.com/mindZvue</li><li> Instagram - https://www.instagram.com/mindzvue</li></ul>",9/6/2023
Customer Support - US Shift - WFO,"customer support,Wfo",Azuga Telematics,INR,Not disclosed,Bengaluru,2-7 Yrs,/job-listings-customer-support-us-shift-wfo-azuga-telematics-bangalore-bengaluru-2-to-7-years-090623007630,Customer Support - US Shift - WFO . <br><br>Shift Timings- Any shift spread across 6pm to 7am . :  . Azuga is looking for a passionate & customer-centric Technical Support Engineer L1 to support our Customers and Sales teams<br><br>Work Timings: Spread across 2 shifts between 6:00 PM IST to 7 AM IST ( Company will provide transportation ) <br><br>Technical aptitude is necessary requirement,9/6/2023
Salesforce Developer,"Salesforce Development,Web services,Salesforce,Development,Troubleshooting,SFDC,Application development,Web technologies",Streams Informatics,INR,Not disclosed,Mohali,3-6 Yrs,/job-listings-salesforce-developer-harmony-data-integration-technologies-mohali-3-to-6-years-090623907437,"Develop / Manage processes to continuously monitor Data quality & integrityDevelop Triggers,Classes,Batch Processes,Controllers,Visualforce Pages,etc<br><br>Candidate having experience in SOAP integration wil get preference<br><br>Good to have experience in working on managed packages and best practices for managed package",9/6/2023
"Senior Consultant, Growth Analytics - Chennai","analytics,salesforce,market research,SQL,Senior,Marketing,Research,Consulting",Frost & Sullivan,INR,Not disclosed,Chennai(Greams Road),9-10 Yrs,/job-listings-senior-consultant-growth-analytics-chennai-frost-sullivan-chennai-tamil-nadu-9-to-10-years-090623007118,"Post graduate qualification in Business Administration / Management/ Economics / Finance/ or ICT/ technical field (MTech,MSc) will be preferred <br><br>Growth Coaching University Certification. About Frost & Sullivan . <br><br> working knowledge of tools like SAS/ Tableau/ R/ Python would be an added advantage (not a must have but a good to have) <br><br>Required Competencies",9/6/2023
Conga Admin,"Administration,Conga",Careernet Technologies,INR,10-18 Lacs PA,"Hybrid - Chennai, Bengaluru",3-8 Yrs,/job-listings-conga-admin-careernet-technologies-chennai-tamil-nadu-bangalore-bengaluru-3-to-8-years-090623006552,"Excellent stakeholder management skills,with the confidence to challenge supportively and. effectively where appropriate. Conga accredited certification preferred<br><br>Experience with the management of data within a Salesforce environment. <br><br>Experience in integration technologies & skills. <br><br>Experience of working with third party suppliers and system integrators.",9/6/2023
Analyst Digital Marketing & Social Media II,"Digital Marketing,Sales,Reputation Management,Automation,System,Media,Marketing,Marketing communication",TE Connectivity,INR,Not disclosed,Bengaluru,2-5 Yrs,/job-listings-analyst-digital-marketing-social-media-ii-te-connectivity-india-private-limited-bangalore-bengaluru-2-to-5-years-090623906517,"They design and maintain relevant portions of TE.com,external data activities and potential partner sites<br><br>Adobe),sales and marketing automation systems (Eloqua,SalesForce.com),Microsoft Office and Adobe marketing tools<br><br> monitor,evaluate and integrate digital programs to maintain the best user experience on TE.com for business units",9/6/2023
