Title,TagsAndSkills,Company,Currency,Salary,Location,Experience,JdURl,Jobdescription,CreatedAt
Salesforce Developer,"Integration,Lwc,Salesforce,Apex,Lightning,Visualforce,Soql,Sales force development",Absika Solutions,INR,Not disclosed,"Hybrid - Chennai, Pune, Bengaluru, Hyderabad, Jaipur",5-10 Yrs,/job-listings-salesforce-developer-absika-solutions-hyderabad-secunderabad-pune-chennai-jaipur-rajasthan-bangalore-bengaluru-5-to-10-years-120623005945,"<p><strong>Role:  <u>Salesforce Developer</u></strong></p><p><strong> Experience:  <u>6-13</u></strong></p><p><strong>Designation: <u>Lead Engineer & Architect</u> (Only Pune Location for  Architect)</strong></p><p><strong>Location: <u>Chennai, Bangalore, Hyderabad, Pune, Jaipur</u>.</strong></p><p><strong>Notice Period :<u> 0-30 days </u></strong></p><br /><br /><p><strong>Responsibilities:</strong></p><ul><li> Develop customized solutions within the Salesforce platform to support critical business functions and meet project objectives, client requirements and company goals.</li><li> Own integrations between Salesforce and other back-office systems.</li><li> Engage with Customer Support, Engineering, Professional Services, and other teams to develop solutions and resolve issues.</li><li> Provide system administration support of the Salesforce environment, especially related to customized applications, user permissions, security settings, custom objects and workflow.</li></ul><p><strong>Requirements:</strong></p><ul><li> Salesforce Certified (Platform Developer I and Platform Developer II preferred).</li><li> Experience with Apex triggers and classes (schedulable and batchable).</li><li> Experience with Visualforce pages and controllers.</li><li> Experience with Salesforce Lightning Interface, Lightning component development, LWC (lightning Web Components).</li><li> Declarative development (flows, process builder, and workflows).</li><li> Experience with Salesforce and other cloud system APIs, SQL, and ETL.</li><li> Experience with JavaScript, HTML/CSS. • Demonstrated ability to work across platforms/applications, participate in multiple projects, and solve technical and business problems.</li><li> Demonstrated ability to work in a distributed, team-oriented, collaborative environment.</li><li> Excellent communication, analytical, troubleshooting, and problem-solving skills</li></ul><br /><br /><br /><p>Contact Details</p><p>Shanthakumar@absika.com</p><br /><br /><p><strong>Note: <u>Below 5years & Admin or testing profile will not be considered</u></strong></p><br />",12/6/2023
Mulesoft Developer,"Salesforce Integration,Salesforce,Connectors,SFDC,SQL,SQL development,Integration,Mule ESB",Wipfli India,INR,Not disclosed,"Hybrid - Pune, Bengaluru",2-4 Yrs,/job-listings-mulesoft-developer-wipfli-india-pune-bangalore-bengaluru-2-to-4-years-150523006295,"<p> <br /> <br /><strong>Position: MuleSoft Developer</strong><br /><strong>(2 to 4</strong> <strong>years of development</strong> <strong>experience with MuleSoft)</strong><br /> <br /> <br /><strong>Type: Full Time Employee (FTE)</strong> <br /><br /><strong><u>Introduction:</u></strong><br /><br />This role requires a solid understanding of the technical foundation of the MuleSoft platform, which includes (but is not limited to) API, SOA, ESB, messaging technologies. Expertise in integration to other external systems, integration testing, and integration governance. The platform architect is a technology enthusiast with a strong track record of building and running high volume, reliable architectures, preferably including cloud, As-A-Service infrastructure, and applications. The individual is expected to be relentlessly focused on platform adoption and user experiences that are continuously improved through iterative development of the platform capabilities. <br /><br />The platform architect is responsible for the platform vision and its evolution to meet tactical and strategic objectives of the business. The platform architect acts as the primary point of contact with the vendors product management to identify needs and prioritize the roadmap items based on business value. <br /><br /><strong><u>Certifications:</u></strong><br /> <br />MuleSoft Developer I&II<br />Integration Architecture Designer<br /><strong><u>Technology skills, Competencies and Experience:</u></strong> <br /></p><ul><li>MuleSoft technology from both development and operations perspective.</li><li>2+ years of experience in Salesforce.com development including creating custom objects & workflows </li><li>2+ years experience in Sales / Service Cloud environments</li><li>Knowledge of object-oriented methodologies and approaches; relational databases and data modelling; enterprise systems, CRM, and ERP/F&OS</li><li>Solid experience within a technical environment performing technical design and architecture roles across technical domains.</li><li>Experience with agile project delivery including continuous integration.</li><li>Experience contributing to and enforcing technical policies, procedures, and standards.  </li></ul><p><br /><strong><u>Education</u>: </strong><br /> <br />Bachelor's degree in Data Science, Marketing, Business, or Communication or a related field<br /><br /><strong><u>Role and</u></strong> <strong><u>Responsibilities:</u></strong> <br /> <br /></p><ul><li>Thorough understanding of web services in general and SOAP and REST specifically; understanding of the basic workings of HTTP/S</li><li>Understanding data migration considerations, design trade-offs, and common ETL tools</li><li>Understanding patterns and mechanisms to secure integrations such as TLS for HTTP</li><li>Experience with common integration patterns</li><li>Experience holding a technical architect role on multiple complex deployments or equivalent knowledge through participation and exposure to these types of projects </li><li>Expert on Salesforce architecture, as well as on using MuleSoft technology</li><li>Technically competent with previous hands-on experience of entire software <br />development lifecycle, including but not limited to the following aspects:</li><ul><li>Java, JavaScript, preferably node.js</li><li>Integration patterns: SOA, ESB and MOM (message-oriented middleware)</li><li>Continuous Integration/Continuous Development</li><li>Maven or Gradle</li><li>REST and SOAP web services</li></ul></ul><br /><ul><li>Expert in defined best practices</li><li>Self-sufficient individual who has practical hands-on experience, is proactive and leads <br />by example of excellence.</li><li>Passion for technology with detailed understanding of existing and emerging <br />technologies.</li><li>Strong knowledge of Cloud platforms, features, and capabilities.</li></ul><p><strong><u>No. of positions:</u></strong> 03<br /> <br /> <br /><strong><u>Work location:</u></strong> Wipfli India, Bengaluru and Pune<br /> <br /> <br />Page <strong>1</strong> of <strong>3</strong><br /> </p>",12/6/2023
Business Development Representative,"cold calling,Inside sales,Sales,Lead generation,Development,Cold,Generation,Business development",Safeguard World Payroll Services,INR,2-7 Lacs PA,"Hybrid - Dehradun, Delhi NCR, Meerut",3-8 Yrs,/job-listings-business-development-representative-safeguard-world-payroll-services-dehradun-uttarakhand-meerut-uttar-pradesh-delhi-ncr-3-to-8-years-120623005833,Ready to work in Night Shifts <br><br>Experience working with Salesforce.com or similar CRM Excellent verbal and written communications skills <br><br>Minimum of 3-5 years experience in B2B inside sales or customer support with US based Companies,12/6/2023
Project Manager,"Project Execution,monday.com,Cloud Services,Marketing Cloud,Salesforce,Marketing,Execution,Project",Omnifin Solutions P Ltd,INR,9-12 Lacs PA,Gurgaon,3-8 Yrs,/job-listings-project-manager-omnifin-solutions-p-ltd-gurgaon-gurugram-haryana-3-to-8-years-120623005764,"Experience as a Project Manager in Salesforce and Monday.com platforms, including configuration and customisation. Knowledge of Marketing Clouds like Salesforce, Adobe & Braze or ESPs & point solutions like Cheetah, Emarsys, DotDigital or Mailchimp",12/6/2023
Sales Development Representative,"Saas Sales,communication skills,CRM sales,Salesforce,Development,Hubspot,SAAS,Cold",Moxtra Solutions,INR,Not disclosed,Hybrid - Bengaluru(Indira Nagar),0-2 Yrs,/job-listings-sales-development-representative-moxtra-solutions-bangalore-bengaluru-0-to-2-years-120623005756,"Bachelors degree (or equivalent) with atleast two years of relevant work experience <br><br>Proficiency with HubSpot / Salesforce or other CRM software <br><br>Required skills and qualifications<br><br>Preferred skills and qualifications<br><br> Two or more years of experience in sales,with a track record of exceeding lead targets",12/6/2023
Senior Business Analyst,"user stories,Technical,Requirements,Documentation,Technical documentation,Solutioning,FRD,Gap analysis",Boston Harbor Consulting,INR,Not disclosed,Chennai(Sholinganallur),7-12 Yrs,/job-listings-senior-business-analyst-boston-harbor-consulting-chennai-7-to-12-years-120623005476,Should have a deep salesforce functional knowledge,12/6/2023
Job Opportunity For SAP QA Analyst_Hyderabad & Bengaluru,"SAP SD,manual testing,Functional Testing,sap testing,Functional,Saps,Automation testing,Automation",Vandey Consultancy Services,INR,15-25 Lacs PA,"Bengaluru, Hyderabad",5-10 Yrs,/job-listings-opportunity-for-sap-qa-analyst-hyderabad-bengaluru-vandey-consultancy-services-hyderabad-secunderabad-telangana-bangalore-bengaluru-5-to-10-years-120623005444,Must have experience with SAP testing<br><br>A willingness to do what it takes to get the job done<br><br> BSc degree or equivalent years of experience <br><br>5+ years of SAP experience in Software Quality Assurance <br><br>5+ years of SAP functional experience in SAP modules <br><br>Experience with Salesforce a plus,12/6/2023
Salesforce Technical Architecture Application Lead,"SFDC,Apex,Technical Architecture,Salesforce,Visualforce,Technical,Technical design,Architecture",Accenture,INR,Not disclosed,Bengaluru,8-10 Yrs,/job-listings-salesforce-technical-architecture-application-lead-accenture-solutions-pvt-ltd-bangalore-bengaluru-8-to-10-years-120623905352,Educational Qualification : Minimum 15 years of full time education <br><br>Additional Information : a Must have PD1 PD2 Certification . <br><br>Professional Attributes : Must have excellent communication and interpersonal skills <br><br>Work Experience :8-10 years,12/6/2023
Salesforce Conga CPQ Application Lead,"CPQ,Sales Cloud,Salesforce,salesforce CPQ,Management,Stakeholder management,Conga,Agile",Accenture,INR,Not disclosed,Kolkata,8-10 Yrs,/job-listings-salesforce-conga-cpq-application-lead-accenture-solutions-pvt-ltd-kolkata-8-to-10-years-120623905347,"Educational Qualification : 15 years of full time education <br><br>Work Experience :8-10 years <br><br>Professional Attributes : 1 Team player,ability to work independently and assist juniors 2 stakeholder management skills,people management and good communication",12/6/2023
Salesforce Lead/Architect,"Salesforce,Mule ESB,Sales,Architecture,Triggers,Lwc,Visualforce,Heroku",MothersonSumi INfotech & Designs (MIND),INR,Not disclosed,Noida,7-12 Yrs,/job-listings-salesforce-lead-architect-mothersonsumi-infotech-designs-mind-noida-uttar-pradesh-7-to-12-years-120623005252,Must have Salesforce Certification(s)<br><br>At least 1 Architect certification preferred <br><br>Minimum 3 years of Solution architecture experience as a Salesforce Solution Architect <br><br>Experience in presenting to senior leaders and C-level execs,12/6/2023
Sales Co-ordinator ( Male / Female ),"Sales Coordination,Office,Marketing,Sales,Sales support,Administration,Marketing support,Back office support",Salesforce,INR,2.75-3.75 Lacs PA,Mumbai(Bhiwandi +1),2-5 Yrs,/job-listings-sales-co-ordinator-male-female-salesforce-mumbai-2-to-5-years-010322001926,"preferred male candidate around Thane or closeby areas eg<br><br>Graduate,3-5 YR EXP<br><br>Navi Mumbai,Dombivili and kalyan,Bhiwandi,good communication skills,good in computers amd familiar with ERP",12/6/2023
Mis Executive,"crm sales,excel,Management Information System,sales audit,MIS Excel,Sales,Report preparation,Sales MIS",upGrad,INR,Not disclosed,Bengaluru,2-7 Yrs,/job-listings-mis-executive-upgrad-bangalore-bengaluru-karnataka-2-to-7-years-120623005079, . Any bachelors degree is a must<br><br>Complete sales forecasts and sales activity reports and presentations in a timely manner. Self-Motivated: Sales Ops should be self-motivated and should be able to perform without much of hand holding. Multi-tasking: This person should be able to do multiple tasks between processes and still deliver results without any errors,12/6/2023
Salesforce - Walk in Drive in Bangalore on 17 Jun,"Lightening web components,LWC,Aura,Salesforce,Components,Web Technology,Lightning,Drives",IDFC FIRST Bank,INR,Not disclosed,"Hybrid - Bangalore Rural, Karnataka",17 Jun,/job-listings-salesforce-walk-in-drive-in-bangalore-on-17-jun-idfc-first-bank-bangalore-rural-karnataka-4-to-9-years-120623005026,"Must have experience in LWC,APEX,Triggers,Batches,Async programming code knowledge.S <br><br> Kind Note - Immediate to 30 Days joiners are only preferred<br><br>Skills Required : . 4 to 9 years of total experience in Salesforce",12/6/2023
Sfdc Admin + Devops,"salesforce,devops,Salesforce Admin,SFDC,Reporting,Administration,Configuration,Design",Quinnox,INR,10-20 Lacs PA,"Hybrid - Bengaluru, Mumbai (All Areas)",5-8 Yrs,/job-listings-sfdc-admin-devops-quinnox-bangalore-bengaluru-mumbai-all-areas-5-to-8-years-120623005012,"<p> </p><p><strong>Experience and Skills:</strong></p><ul><li>5 to 8 years of IT experience with hands-on development in SFDC technologies.</li><li>Should have Deployment experience and DevOps.</li><li>Coordination of and execution of deployment activities for the team (on shore and off shore).</li><li>Responsible for validating and deployment pages using our deployment toolkit and following best practices.</li><li>Maintain and manage the Salesforce Sandbox topology from development up to production.</li><li>Apply change management processes for documenting, communicating, and testing code releases from Sandboxes to Production environments.</li><li>Experience with Version Control, Git or other SCM systems.</li><li>Experience with deployment tools like Jenkin, Flosum etc.</li><li>Manage and maintain Salesforce security access, profiles and permission sets.  Work with Org's internal controls and governance groups to ensure compliance with best practices and company standards.</li><li>Manages all new user set-ups and deactivation, including transferring ownership of accounts/contacts/opportunities for deactivated users.</li><li>Okta, SSO experience will be a plus.</li><li>Performs mass data imports as needed.</li><li>Abide by team coding standards, development processes and best practices.</li><li>Manage code repository, code deployment, and other environment tools and subscriptions.</li><li>Manage communication with Salesforce to keep team informed on environmental changes, report bugs to Salesforce, and support team information requests.</li><li>Regularly audits the environments to uncover data, integrity issues and/or opportunities for process improvement.</li><li>Salesforce data model and architecture understanding.</li><li>Knowledge of Salesforce recommended best practice around design, deployment and development.</li><li>Should be proficient in Salesforce design, configuration, Salesforce reporting.</li><li>Experience in data migration activities from lower environment to production and address issues related to functionality and integration.</li><li>Proficiency with Salesforce.com development including creation of standard and custom objects and fields etc.  </li><li>Analytical & problem-solving skills</li></ul><p><strong>Communication</strong>:</p><ul><li>Fair understanding of working with on-shore and stakeholders.</li><li>Good Verbal and written Communication Skills. </li></ul><p><strong>Desirable</strong>: </p><p>Experience in the Transport / Logistics Industry and the technologies that support business activities.</p><p><strong>Certifications:</strong></p><ul><li>Salesforce Platform developer 1 or Platform App Builder.</li><li>Salesforce Admin Certification.</li></ul><br /><br />",12/6/2023
SAP Basis,"SAP,C4S,HANA,AWS,Ariba,GCP,Microsoft Azure,SAP Hana",HCLTech,INR,Not disclosed,Remote,5-10 Yrs,/job-listings-sap-basis-hcltech-any-5-to-10-years-120123006948,"Experience: (CAA Role)- REX (SAP Basis,SAP HANA and S / 4 HANA skills,Migration/ Upgrades & Experience on Any Cloud (AWS,MS Azure,GCP) Good Comm Skill,who can articulate,Experience in Customer Facing. Notice Period: 30 days <br><br>Good understanding & hands-on experience required in S / 4 HANA application & HANA database<br><br>Experience in SAP Upgrade & Migration (OS / DB) is required",12/6/2023
Urgent Hiring For Female candidates For Sales Profile,"VISA,Sales,Travel Sales,Immigration,Salesforce,Business development management,Management,Development",Vaiteek Holidays,INR,1.75-3 Lacs PA,"Delhi NCR, Delhi",0-5 Yrs,/job-listings-urgent-hiring-for-female-candidates-for-sales-profile-vaiteek-holidays-new-delhi-delhi-ncr-0-to-5-years-120623004709,Should be target oriented and self driven <br><br>Good Interpersonal and persuasion skills <br><br>Good Convincing power,12/6/2023
Freshers required For Immigration Consultant In Delhi (Female Only),"Immigration counsellor,Visa counsellor,Sales,Travel Sales,Visa Processing,CRM,Visa counselling,Salesforce",Vaiteek Holidays,INR,1.75-3 Lacs PA,"Delhi NCR, Delhi(Netaji Subhash Place)",0-5 Yrs,/job-listings-freshers-required-for-immigration-consultant-in-delhi-female-only-vaiteek-holidays-new-delhi-delhi-ncr-0-to-5-years-120623004700,"Call Priya : +91 9643862405
Job Location: Netaji Subhash Palace, New Delhi
Role: Visa/Immigration Counselling
Salary: Fixed + Incentive
Vacancy : 10-Experience in BPO/Visa Services.
-Fluency in English must.
-Highly motivated and great interpersonal skills.
-Must be presentable and attitude to close deals.
-Able to handle work under pressure.",12/6/2023
Urgent hiring For female candidates For Immigration Consultant,"Immigration counsellor,Sales,Travel Sales,Immigration,Visa Processing,Salesforce,Consulting,Travel",Vaiteek Holidays,INR,1.75-3 Lacs PA,"Delhi NCR, Delhi",0-5 Yrs,/job-listings-urgent-hiring-for-female-candidates-for-immigration-consultant-vaiteek-holidays-new-delhi-delhi-ncr-0-to-5-years-120623004687,"Call Priya : +91 9643862405
Job Location: Netaji Subhash Palace, New Delhi
Role: Visa/Immigration Counselling
Salary: Fixed + Incentive
Vacancy : 18-Experience in BPO/Visa Services.
-Fluency in English must.
-Highly motivated and great interpersonal skills.
-Must be presentable and attitude to close deals.
-Able to handle work under pressure.",12/6/2023
Female required Fresher Graduates For Sales profile,"Key Account Management,Sales,Business Development,Immigration,Customer service,Visa Filing,Key accounts,Key",Vaiteek Holidays,INR,1.25-2.5 Lacs PA,"Delhi NCR, Delhi",0-5 Yrs,/job-listings-female-required-fresher-graduates-for-sales-profile-vaiteek-holidays-new-delhi-delhi-ncr-0-to-5-years-120623004680,"Call Priya : 9643862405
Job Location: Netaji Subhash Palace, New Delhi
Role: Sales Executive (Girls Only)
Field : Travel / Immigration
Salary: Fixed + IncentiveExperience in Immigration/BPO (Freshers Welcome)
Fluency in English must.
Basic knowledge of computers; MS Office.
Must be presentable and attitude to close deals.
Able to handle work under pressure.",12/6/2023
Salesforce Lightning Web Components Application Developer,"SLDS,Web technologies,Data modeling,Lightning Data,Salesforce,Lighting,Customization,Apex",Accenture,INR,Not disclosed,Bengaluru,4-6 Yrs,/job-listings-salesforce-lightning-web-components-application-developer-accenture-solutions-pvt-ltd-bangalore-bengaluru-4-to-6-years-120623904476,Educational Qualification : 1 Regular 15-year full time education . <br><br>Professional Attributes : A Good Oral and written communication skills B Attitude to learn new technologies C Excellent Team player <br><br>Work Experience :4-6 years,12/6/2023
Tech Lead - Salesforce,"SFDC,LWC,Components,Salesforce,Apex,Visualforce,Aura,Triggers",Ranosys Technologies,INR,Not disclosed,Jaipur,6-9 Yrs,/job-listings-tech-lead-salesforce-ranosys-technologies-jaipur-6-to-9-years-100621002929,"Must possess superb communication,analytical and time management skills<br><br>Certification: Must be Salesforce.com Platform Developer II Certified<br><br>Experience in translating business requirements into working solutions using a combination of Salesforce.com configuration and custom development approaches<br><br>Good understanding of Salesforce Administration activities",12/6/2023
Accounts Executive,"Collections,Accounting,Order To Cash,Quote To Cash,Salesforce,Oracle,Order fulfillment,Management",Morningstar,INR,Not disclosed,Hybrid - Navi Mumbai,1-5 Yrs,/job-listings-accounts-executive-morningstar-navi-mumbai-maharashtra-1-to-5-years-120623004380,"A bachelors degree is required<br><br> Three to five years of experience in an accountant or related position<br><br>Experience with SalesForce.com,Oracles Contracts,Accounts Receivable and Cash Management modules is a plus<br><br>Critical-thinking and willingness to pro-actively surface areas of improvement<br><br>Good Writing and Verbal Communication skill",12/6/2023
Senior Salesforce Developer,"Salesforce Integration,apex classes,salesforce developer,Salesforce,Apex,Sales,Sales force development,Development",Aakash Educational Services (AESL),INR,15-25 Lacs PA,Hybrid - Noida,4-6 Yrs,/job-listings-senior-salesforce-developer-aakash-educational-services-aesl-noida-4-to-6-years-240423001063,"Skills and Qualifications :  . - At least 3 years of Salesforce development experience . - Experience in Agile development methodologies - Detail-oriented,organized,and possess good writing and communication skills . - Ability to operate effectively,and with a sense of ownership,in a fast-paced,deadline- driven environment",12/6/2023
Sap fsri- Work From Home- Freelancer,"sap fsri,SAP,Management,Freelancing,Reinsurance,Insurance,sap reinsurance management,sap reinsurance",Techavera Solutions,INR,20-35 Lacs PA,Remote,10-17 Yrs,/job-listings-sap-fsri-work-from-home-freelancer-techavera-solutions-india-10-to-17-years-140523001375,"fill out the form to start taking sap freelancing classes, WEEKDAYS/WEEKEND/Timings, Choose module AND HR WILL CONTACT YOU



https://saponlineclasses.com/Salesforce/hr-recruiter/HR_Evalu.php


Salary: discussed on call per candidate @8506888288",12/6/2023
Sr Associate- Backend Engineer,"AWS,Lambda Expressions,S,Amazon Ec2,SR,Backend,S3,EC2",HiREarchy,INR,Not disclosed,Pune,8-12 Yrs,/job-listings-sr-associate-backend-engineer-hirearchy-pune-8-to-12-years-120623004183,"Roles and Responsibilities . Sr Associate- Backend Engineer (Female can apply only)<br><br>Equivalent practical experience on the job as a software engineer will also qualify candidates,depending on level and type of experience<br><br>BS degree preferred in Computer Science or related technical field<br><br>Experience with cloud computing and the AWS suite",12/6/2023
